{
  "goal": "Seed the workspace from <scratch>/eval-dag/workspace/, then audit every pipelib module against its own docstrings, fix each latent defect at its cause, add a regression test per defect that fails on the old code and passes on the fix, never delete/loosen an existing test or weaken a docstring, and leave 'pytest tests/ -q' green.",
  "deps": [],
  "entries": [
    {
      "spec": {
        "node_id": "setup",
        "kind": "work",
        "deadline_s": 900,
        "deps": [],
        "isolation": "none",
        "tier_role": "mechanical",
        "write_set": ["."],
        "knowledge": []
      },
      "op": "work",
      "args": {},
      "brief": "Step 0 of the task: in the current working directory run exactly\n    cp -a <scratch>/eval-dag/workspace/. .\nThen: (1) run 'pytest tests/ -q' and confirm it is green on the untouched seed (record the pass count); (2) list every Python module under pipelib/ with 'ls pipelib/*.py | sort' and count them; (3) write inventory.md in your node directory containing: the sorted module list with one line per module giving its path, line count and a one-sentence summary of what it does (from its module docstring), the baseline pytest pass count, and the list of files under tests/. Do NOT modify any source or test file. Do not investigate defects - that is later work. Report the module count and baseline pass count in your handover key_facts.",
      "output_contract": ["inventory.md"],
      "acceptance": {
        "all": [
          {"ref": {"entry": "setup", "field": "turns"}, "op": ">=", "value": 1}
        ]
      }
    },
    {
      "spec": {
        "node_id": "audit_a",
        "kind": "work",
        "deadline_s": 3600,
        "deps": ["setup"],
        "isolation": "none",
        "tier_role": "deep",
        "write_set": ["pipelib/", "tests/test_regressions_a.py"],
        "knowledge": ["../setup/inventory.md"]
      },
      "op": "work",
      "args": {},
      "brief": "You are auditor A of four (A=0, B=1, C=2, D=3) working on pipelib in the current directory (already seeded; do NOT re-copy). Ownership rule, applied identically by every auditor so the split is disjoint: take the output of 'ls pipelib/*.py | sort', EXCLUDING pipelib/__init__.py, number the files from 0, and own every file whose index modulo 4 equals 0. Auditor A additionally owns pipelib/__init__.py. Do not edit any file you do not own; if you spot a defect in a file you do not own, describe it (file, function, line, expected vs actual behaviour) in your findings.md so the integrator can check it was handled.\n\nFor each owned module: read the whole file slowly, function by function. For every function, state what its docstring promises (return value, boundaries, inclusive/exclusive ranges, handling of empty input, None, whitespace, negative numbers, unicode, duplicates, ordering, error cases) and check the code against that promise. The planted defects are the classic kinds: off-by-one in slicing/range/index, wrong boundary comparison (< vs <=), mutable default argument, exception swallowed or too broad, comparison that fails on an edge case (empty string, zero, None, NaN, mixed case, trailing whitespace), wrong operator precedence, wrong variable used, early return that skips part of the input, aliasing a list instead of copying, wrong rounding, and similar. Expect roughly one or more defects per module; keep looking until you have checked every function. The existing tests in tests/ pass on the buggy code and prove nothing.\n\nFor every defect you find: (1) fix the CAUSE in the module so the documented behaviour holds - never change a docstring to match the bug, never special-case a symptom; (2) add a regression test to tests/test_regressions_a.py (create it; this is the ONLY test file you may write) that fails on the old code and passes on your fix - verify this by temporarily reverting the fix (or testing against a copy of the original module) and running the test, then re-applying the fix; name each test test_<module>_<function>_<what> and put a one-line comment stating the defect. Never delete, rename, skip or loosen any existing test. Existing tests must still pass after your fix; if an existing test contradicts a docstring, the docstring wins - report the conflict in findings.md rather than editing the existing test, and make the fix satisfy the docstring.\n\nBefore finishing: run 'pytest tests/ -q' and make sure it is fully green. Write findings.md in your node directory listing every defect you fixed (module, function, defect, fix, regression test name) and any suspected defects in files you do not own. Put the count of defects fixed in key_facts.",
      "output_contract": ["findings.md"],
      "acceptance": {
        "all": [
          {"ref": {"entry": "audit_a", "field": "turns"}, "op": ">=", "value": 1}
        ]
      }
    },
    {
      "spec": {
        "node_id": "audit_b",
        "kind": "work",
        "deadline_s": 3600,
        "deps": ["setup"],
        "isolation": "none",
        "tier_role": "deep",
        "write_set": ["pipelib/", "tests/test_regressions_b.py"],
        "knowledge": ["../setup/inventory.md"]
      },
      "op": "work",
      "args": {},
      "brief": "You are auditor B of four (A=0, B=1, C=2, D=3) working on pipelib in the current directory (already seeded; do NOT re-copy). Ownership rule, applied identically by every auditor so the split is disjoint: take the output of 'ls pipelib/*.py | sort', EXCLUDING pipelib/__init__.py, number the files from 0, and own every file whose index modulo 4 equals 1. Do not edit any file you do not own; if you spot a defect in a file you do not own, describe it (file, function, line, expected vs actual behaviour) in your findings.md so the integrator can check it was handled.\n\nFor each owned module: read the whole file slowly, function by function. For every function, state what its docstring promises (return value, boundaries, inclusive/exclusive ranges, handling of empty input, None, whitespace, negative numbers, unicode, duplicates, ordering, error cases) and check the code against that promise. The planted defects are the classic kinds: off-by-one in slicing/range/index, wrong boundary comparison (< vs <=), mutable default argument, exception swallowed or too broad, comparison that fails on an edge case (empty string, zero, None, NaN, mixed case, trailing whitespace), wrong operator precedence, wrong variable used, early return that skips part of the input, aliasing a list instead of copying, wrong rounding, and similar. Expect roughly one or more defects per module; keep looking until you have checked every function. The existing tests in tests/ pass on the buggy code and prove nothing.\n\nFor every defect you find: (1) fix the CAUSE in the module so the documented behaviour holds - never change a docstring to match the bug, never special-case a symptom; (2) add a regression test to tests/test_regressions_b.py (create it; this is the ONLY test file you may write) that fails on the old code and passes on your fix - verify this by temporarily reverting the fix (or testing against a copy of the original module) and running the test, then re-applying the fix; name each test test_<module>_<function>_<what> and put a one-line comment stating the defect. Never delete, rename, skip or loosen any existing test. Existing tests must still pass after your fix; if an existing test contradicts a docstring, the docstring wins - report the conflict in findings.md rather than editing the existing test, and make the fix satisfy the docstring.\n\nBefore finishing: run 'pytest tests/ -q' and make sure it is fully green. Write findings.md in your node directory listing every defect you fixed (module, function, defect, fix, regression test name) and any suspected defects in files you do not own. Put the count of defects fixed in key_facts.",
      "output_contract": ["findings.md"],
      "acceptance": {
        "all": [
          {"ref": {"entry": "audit_b", "field": "turns"}, "op": ">=", "value": 1}
        ]
      }
    },
    {
      "spec": {
        "node_id": "audit_c",
        "kind": "work",
        "deadline_s": 3600,
        "deps": ["setup"],
        "isolation": "none",
        "tier_role": "deep",
        "write_set": ["pipelib/", "tests/test_regressions_c.py"],
        "knowledge": ["../setup/inventory.md"]
      },
      "op": "work",
      "args": {},